{"corpusSchemaVersion":"1","corpusId":"corpus.kit.legitimate-burst.v1.b2bf7088fe26","scenarioId":"kit.legitimate-burst.v1","scenarioVersion":"1.0.0","scenarioSha256":"1e46d6c8a54089b3388ddc53ea07053a6202891f1e492670d62accf1d411aadf","seed":"kit-ref-legitimate-burst-1","generatorContractVersion":"1","generatorBuildId":"aisentinel-kit-reference-corpus@1","featureSchemaVersion":"1","evaluationEventSchemaVersion":"1","representationMode":"feature-level","artifacts":[{"role":"events","path":"events.jsonl","sha256":"518706f155e516dd3698c2fc7fa5ef92ca323c09e5ddacdf362f31603222e12f","mediaType":"application/x-ndjson"}],"annotationsArtifact":{"role":"annotations","path":"annotations.json","sha256":"dc6a87bd01fa6870efd9108fdc5206fc3d7387998f92a44cac4590ebe67da27e","mediaType":"application/json"},"timing":{"warmupDurationSeconds":4,"evaluationDurationSeconds":6},"eventCount":10,"notes":"Deterministic feature-level corpus generated from Evaluation Kit scenario."}
