{"corpusSchemaVersion":"1","corpusId":"corpus.kit.abrupt-burst.v1.5afeb4a4b099","scenarioId":"kit.abrupt-burst.v1","scenarioVersion":"1.0.0","scenarioSha256":"5382896ebb61fb454bd2f194da95d1e8baaecd5dd7e11dc81bf182f4778e42e3","seed":"kit-ref-abrupt-burst-1","generatorContractVersion":"1","generatorBuildId":"aisentinel-kit-reference-corpus@1","featureSchemaVersion":"1","evaluationEventSchemaVersion":"1","representationMode":"feature-level","artifacts":[{"role":"events","path":"events.jsonl","sha256":"47efcb142e571056e73d182aa25e2fd6e2a955112d990bc3079753f63cfd4643","mediaType":"application/x-ndjson"}],"annotationsArtifact":{"role":"annotations","path":"annotations.json","sha256":"56c34d759d476e19c1bcc202cd137fde54bbcbe19c921e2d9b18ec9e66f25463","mediaType":"application/json"},"timing":{"warmupDurationSeconds":4,"evaluationDurationSeconds":6},"eventCount":10,"notes":"Deterministic feature-level corpus generated from Evaluation Kit scenario."}
