{"corpusSchemaVersion":"1","corpusId":"corpus.kit.recovery.v1.bb526d92cce4","scenarioId":"kit.recovery.v1","scenarioVersion":"1.0.0","scenarioSha256":"376a37cd41ffe991b7f763cf2c5e86be5e47f67cad7ff8af00f69b0aac117c43","seed":"kit-ref-recovery-1","generatorContractVersion":"1","generatorBuildId":"aisentinel-kit-reference-corpus@1","featureSchemaVersion":"1","evaluationEventSchemaVersion":"1","representationMode":"feature-level","artifacts":[{"role":"events","path":"events.jsonl","sha256":"beae2c0f78b992a3137db4d304f9b7ed861ab1b12dd48100f436aa7446193262","mediaType":"application/x-ndjson"}],"annotationsArtifact":{"role":"annotations","path":"annotations.json","sha256":"364f9c95f515d9fc9445f4a94adff78fa9f29c0a79f5e22602de756c75beb0c4","mediaType":"application/json"},"timing":{"warmupDurationSeconds":4,"evaluationDurationSeconds":6},"eventCount":10,"notes":"Deterministic feature-level corpus generated from Evaluation Kit scenario."}
