{"corpusSchemaVersion":"1","corpusId":"corpus.northgate.abrupt-burst.v1.87421db9ade8","scenarioId":"northgate.abrupt-burst.v1","scenarioVersion":"1.0.0","scenarioSha256":"c26da705dabf8a2585d5a9d65ced6443d32c4a214ed112f04b431e3c668ae905","seed":"northgate-abrupt-burst-1","generatorContractVersion":"1","generatorBuildId":"aisentinel-northgate-corpus@1","featureSchemaVersion":"1","evaluationEventSchemaVersion":"1","representationMode":"feature-level","artifacts":[{"role":"events","path":"events.jsonl","sha256":"625810d6271cc1f22c289b59ae4c587ccbd7b5913cd5582c0592d6e28d7ed95f","mediaType":"application/x-ndjson"}],"annotationsArtifact":{"role":"annotations","path":"annotations.json","sha256":"af25661f6a3f280ada294982f6795daf4e36ec04ca79cdd4a3fd5268e724fe8e","mediaType":"application/json"},"timing":{"warmupDurationSeconds":48,"evaluationDurationSeconds":32},"eventCount":80,"notes":"Deterministic feature-level corpus generated from Evaluation Kit scenario."}
