{"corpusSchemaVersion":"1","corpusId":"corpus.northgate.endpoint-shift.v1.c8a47d725935","scenarioId":"northgate.endpoint-shift.v1","scenarioVersion":"1.0.0","scenarioSha256":"3a010d4bd32908382d467904f7c7958099224e8b065ec5955d81d057a70e96b7","seed":"northgate-endpoint-shift-1","generatorContractVersion":"1","generatorBuildId":"aisentinel-northgate-corpus@1","featureSchemaVersion":"1","evaluationEventSchemaVersion":"1","representationMode":"feature-level","artifacts":[{"role":"events","path":"events.jsonl","sha256":"e7b713469a4f2f9fe4ac6aef9883b9c685ee100d734996aea531d80e6c64a0e9","mediaType":"application/x-ndjson"}],"annotationsArtifact":{"role":"annotations","path":"annotations.json","sha256":"12f7ec686629b1464d61c2e2db4a5623b8eb6ac153c7d238eb211bf0acbeae87","mediaType":"application/json"},"timing":{"warmupDurationSeconds":48,"evaluationDurationSeconds":32},"eventCount":80,"notes":"Deterministic feature-level corpus generated from Evaluation Kit scenario."}
