{"corpusSchemaVersion":"1","corpusId":"corpus.kit.endpoint-distribution-change.v1.4f4b67c6aead","scenarioId":"kit.endpoint-distribution-change.v1","scenarioVersion":"1.0.0","scenarioSha256":"3c3b87513951ef6f090d1823ffdf926b12698b43bc781eecf602474e6fbceb1b","seed":"kit-ref-endpoint-distribution-change-1","generatorContractVersion":"1","generatorBuildId":"aisentinel-kit-reference-corpus@1","featureSchemaVersion":"1","evaluationEventSchemaVersion":"1","representationMode":"feature-level","artifacts":[{"role":"events","path":"events.jsonl","sha256":"9d96f2439238ca2c3bfc6634c1a28fd2f971d126164d31c3412f31397e678135","mediaType":"application/x-ndjson"}],"annotationsArtifact":{"role":"annotations","path":"annotations.json","sha256":"c4d9b889934f6bfdb687f25b24ff659529edec015a4cf6f52c4507467a8aa1c7","mediaType":"application/json"},"timing":{"warmupDurationSeconds":4,"evaluationDurationSeconds":6},"eventCount":10,"notes":"Deterministic feature-level corpus generated from Evaluation Kit scenario."}
