{"corpusSchemaVersion":"1","corpusId":"corpus.kit.multi-feature-anomaly.v1.5f5f77f02747","scenarioId":"kit.multi-feature-anomaly.v1","scenarioVersion":"1.0.0","scenarioSha256":"475f53ce9f949df30ecc02b364e0a824bfdb0c73d39ac72168b04b422440d5fa","seed":"kit-ref-multi-feature-anomaly-1","generatorContractVersion":"1","generatorBuildId":"aisentinel-kit-reference-corpus@1","featureSchemaVersion":"1","evaluationEventSchemaVersion":"1","representationMode":"feature-level","artifacts":[{"role":"events","path":"events.jsonl","sha256":"93ebc0f0d8dfb48ae1cbb358e42d5c9f4c441c76bbcf12656c516a4ae7450294","mediaType":"application/x-ndjson"}],"annotationsArtifact":{"role":"annotations","path":"annotations.json","sha256":"3deacbdaaf9eff44cd33faac96b25c900de78a6b97cd7e7f2cb2b7351063b4ec","mediaType":"application/json"},"timing":{"warmupDurationSeconds":4,"evaluationDurationSeconds":6},"eventCount":10,"notes":"Deterministic feature-level corpus generated from Evaluation Kit scenario."}
