{"corpusSchemaVersion":"1","corpusId":"corpus.kit.low-variance-deviation.v1.eb2737ee8b17","scenarioId":"kit.low-variance-deviation.v1","scenarioVersion":"1.0.0","scenarioSha256":"7d03b55d88ac163955c6a6e51bc931631fb9aa9f269245235559570754b33d90","seed":"kit-ref-low-variance-deviation-1","generatorContractVersion":"1","generatorBuildId":"aisentinel-kit-reference-corpus@1","featureSchemaVersion":"1","evaluationEventSchemaVersion":"1","representationMode":"feature-level","artifacts":[{"role":"events","path":"events.jsonl","sha256":"761204f49c094b8c96304d50733d76db703e8a083eaba6983e4e695676be7ecc","mediaType":"application/x-ndjson"}],"annotationsArtifact":{"role":"annotations","path":"annotations.json","sha256":"d1f3b84986df389bb7b7b2301bebd097fc1fde71c8b6d0109c78424d2eb8954c","mediaType":"application/json"},"timing":{"warmupDurationSeconds":4,"evaluationDurationSeconds":6},"eventCount":10,"notes":"Deterministic feature-level corpus generated from Evaluation Kit scenario."}
