{"corpusSchemaVersion":"1","corpusId":"corpus.kit.gradual-drift.v1.8919ea58c9f2","scenarioId":"kit.gradual-drift.v1","scenarioVersion":"1.0.0","scenarioSha256":"5b1fbc53f448c48619bc2f8a555d825a99baac620f92602497f401eee33b0642","seed":"kit-ref-gradual-drift-1","generatorContractVersion":"1","generatorBuildId":"aisentinel-kit-reference-corpus@1","featureSchemaVersion":"1","evaluationEventSchemaVersion":"1","representationMode":"feature-level","artifacts":[{"role":"events","path":"events.jsonl","sha256":"41ddd6068de54c910f27239c428b5f7d79d95a813b05711598fd02019b33b2b3","mediaType":"application/x-ndjson"}],"annotationsArtifact":{"role":"annotations","path":"annotations.json","sha256":"f061cb3f01e8af0f5cb1f5706a4e6af4fe255980f0887d2ce4c8df8e423be2d7","mediaType":"application/json"},"timing":{"warmupDurationSeconds":4,"evaluationDurationSeconds":6},"eventCount":10,"notes":"Deterministic feature-level corpus generated from Evaluation Kit scenario."}
