{"corpusSchemaVersion":"1","corpusId":"corpus.kit.identity-session-transition.v1.c6e02b593f8d","scenarioId":"kit.identity-session-transition.v1","scenarioVersion":"1.0.0","scenarioSha256":"ad5a2b7db0e46eea923f1a818a824aca5d6f4d2e067affe67d2a996db56dab42","seed":"kit-ref-identity-session-transition-1","generatorContractVersion":"1","generatorBuildId":"aisentinel-kit-reference-corpus@1","featureSchemaVersion":"1","evaluationEventSchemaVersion":"1","representationMode":"feature-level","artifacts":[{"role":"events","path":"events.jsonl","sha256":"31560cb2d929ff56c256870f467e8926034a0791aadbe606428e973bfcda5534","mediaType":"application/x-ndjson"}],"annotationsArtifact":{"role":"annotations","path":"annotations.json","sha256":"f9dc88068cbfeb164c0ea35856d513d3af46f4611de6814e0bd70b5e76083604","mediaType":"application/json"},"timing":{"warmupDurationSeconds":4,"evaluationDurationSeconds":6},"eventCount":10,"notes":"Deterministic feature-level corpus generated from Evaluation Kit scenario."}
