{"corpusSchemaVersion":"1","corpusId":"corpus.kit.established-normal.v1.dffe70ac8547","scenarioId":"kit.established-normal.v1","scenarioVersion":"1.0.0","scenarioSha256":"6f041f35695fd15573a43fdac60e744c0491c22d857c52edbc6cc63a80e5fe01","seed":"kit-ref-established-normal-1","generatorContractVersion":"1","generatorBuildId":"aisentinel-kit-reference-corpus@1","featureSchemaVersion":"1","evaluationEventSchemaVersion":"1","representationMode":"feature-level","artifacts":[{"role":"events","path":"events.jsonl","sha256":"45cfab5a5e24a5f1495638f1af183de6358356d69a520b10c379c76ccec68817","mediaType":"application/x-ndjson"}],"annotationsArtifact":{"role":"annotations","path":"annotations.json","sha256":"9591b87ac765a246a9886fe561c195815eacdbfdd0fd16dbd43e0e4e0c320a80","mediaType":"application/json"},"timing":{"warmupDurationSeconds":4,"evaluationDurationSeconds":6},"eventCount":10,"notes":"Deterministic feature-level corpus generated from Evaluation Kit scenario."}
