{"corpusSchemaVersion":"1","corpusId":"corpus.northgate.legitimate-burst.v1.d7613c462db0","scenarioId":"northgate.legitimate-burst.v1","scenarioVersion":"1.0.0","scenarioSha256":"945ad3e38e509352489d9c4dd2b911d7a0e7cc9e8d39732eb89e904df04af209","seed":"northgate-legitimate-burst-1","generatorContractVersion":"1","generatorBuildId":"aisentinel-northgate-corpus@1","featureSchemaVersion":"1","evaluationEventSchemaVersion":"1","representationMode":"feature-level","artifacts":[{"role":"events","path":"events.jsonl","sha256":"2682d0ba7c6b965ff2147a67616c7eb6f7da4384a706366c4203fe37f5495982","mediaType":"application/x-ndjson"}],"annotationsArtifact":{"role":"annotations","path":"annotations.json","sha256":"085f91ca80dd06b95ef136b1e7f9453f9f739545db4caa79169dde9dcc789034","mediaType":"application/json"},"timing":{"warmupDurationSeconds":48,"evaluationDurationSeconds":32},"eventCount":80,"notes":"Deterministic feature-level corpus generated from Evaluation Kit scenario."}
