{"corpusSchemaVersion":"1","corpusId":"corpus.northgate.established-normal.v1.947df7d6ac98","scenarioId":"northgate.established-normal.v1","scenarioVersion":"1.0.0","scenarioSha256":"893aeb9c3ca754595f57a6691bb589d0cac3dc1ce701855a73a2e26c284c94e2","seed":"northgate-established-normal-1","generatorContractVersion":"1","generatorBuildId":"aisentinel-northgate-corpus@1","featureSchemaVersion":"1","evaluationEventSchemaVersion":"1","representationMode":"feature-level","artifacts":[{"role":"events","path":"events.jsonl","sha256":"9d2ce6c4cf99b74b62c9d6bd1561000a404236f968c826f8483e405e1538eed3","mediaType":"application/x-ndjson"}],"annotationsArtifact":{"role":"annotations","path":"annotations.json","sha256":"8d4d8a8251730f0d1c8fe6f1468b3f0a64a297fcc4059827de8654e8337a1786","mediaType":"application/json"},"timing":{"warmupDurationSeconds":48,"evaluationDurationSeconds":32},"eventCount":80,"notes":"Deterministic feature-level corpus generated from Evaluation Kit scenario."}
