{"corpusSchemaVersion":"1","corpusId":"corpus.kit.warmup-cold-start.v1.ae11e2a00307","scenarioId":"kit.warmup-cold-start.v1","scenarioVersion":"1.0.0","scenarioSha256":"40768fb1a32a3847fe2c70f75e21a9714b2f693cc0b7c1a9110b075008a5041a","seed":"kit-ref-warmup-cold-start-1","generatorContractVersion":"1","generatorBuildId":"aisentinel-kit-reference-corpus@1","featureSchemaVersion":"1","evaluationEventSchemaVersion":"1","representationMode":"feature-level","artifacts":[{"role":"events","path":"events.jsonl","sha256":"3690571ddd94f2bd0fcd5d2c26fe91caa9eeed7c64e13c5d6b160ed00c04abb6","mediaType":"application/x-ndjson"}],"annotationsArtifact":{"role":"annotations","path":"annotations.json","sha256":"affbdf01246c161418870a253bbb7a3a727504124abc11d67e134f515526f4b2","mediaType":"application/json"},"timing":{"warmupDurationSeconds":1,"evaluationDurationSeconds":6},"eventCount":7,"notes":"Deterministic feature-level corpus generated from Evaluation Kit scenario."}
