{"corpusSchemaVersion":"1","corpusId":"corpus.northgate.session-recovery.v1.7e78185cbf02","scenarioId":"northgate.session-recovery.v1","scenarioVersion":"1.0.0","scenarioSha256":"afa6c3446acbb13c058bc61e19516b432613b5d6465c618682da862604fadfbd","seed":"northgate-session-recovery-1","generatorContractVersion":"1","generatorBuildId":"aisentinel-northgate-corpus@1","featureSchemaVersion":"1","evaluationEventSchemaVersion":"1","representationMode":"feature-level","artifacts":[{"role":"events","path":"events.jsonl","sha256":"82567e09c5b8f3b2c5a7df2bac6554b82336bc40ff4984e298f27e0ede3811ee","mediaType":"application/x-ndjson"}],"annotationsArtifact":{"role":"annotations","path":"annotations.json","sha256":"4f9e8c55f7cebec8b51ba621886d279a182d524d2cbdcf6af7bb5e5c1fc34174","mediaType":"application/json"},"timing":{"warmupDurationSeconds":48,"evaluationDurationSeconds":32},"eventCount":80,"notes":"Deterministic feature-level corpus generated from Evaluation Kit scenario."}
